{
  "$schema": "./profile-schema.json",
  "name": "Siwoo Hyong",
  "domain": "gudtldn.dev",
  "status": [
    "Student",
    "Developer"
  ],
  "location": "Gyeonggi-do, South Korea",
  "timezone": "Asia/Seoul",
  "timezoneAbbr": "KST",
  "blogUrl": "https://blog.gudtldn.dev",
  "blogFeedUrl": "https://blog.gudtldn.dev/feed.xml",
  "bio": "C++, 그래픽스 프로그래밍에 대해서 공부하고 있는 학생 개발자 입니다. 단순히 돌아가는 코드보다 그 이면의 원리와 아키텍처를 고민하고, 배운 것을 기록으로 남기는 것을 좋아합니다.",
  "socials": [
    {
      "platform": "GitHub",
      "url": "https://github.com/gudtldn",
      "id": "gudtldn"
    },
    {
      "platform": "Email",
      "url": "mailto:me@gudtldn.dev",
      "id": "me@gudtldn.dev"
    },
    {
      "platform": "Discord",
      "url": "#",
      "id": "ordinary_human"
    }
  ],
  "customLinks": [],
  "currentlyFocusing": [
    { "category": "Low-level", "item": "x86-64 Assembly" },
    { "category": "Graphics", "item": "DirectX / SDL3GPU" },
    { "category": "Game Engine", "item": "Unreal Engine 5" },
    { "category": "Systems", "item": "Modern C++ / Rust" }
  ],
  "techStack": {
    "languages": [
      { "name": "C++", "logo": "cpp", "url": "https://en.cppreference.com/" },
      { "name": "Rust", "logo": "rust", "url": "https://www.rust-lang.org/" },
      { "name": "Python", "logo": "py", "url": "https://www.python.org/" },
      { "name": "HLSL", "logo": "visualstudio", "url": "https://learn.microsoft.com/en-us/windows/win32/direct3dhlsl/dx-graphics-hlsl" }
    ],
    "tools": [
      { "name": "Unreal Engine", "logo": "unreal", "url": "https://www.unrealengine.com/" },
      { "name": "Rider", "logo": "rider", "url": "https://www.jetbrains.com/rider/" },
      { "name": "CLion", "logo": "clion", "url": "https://www.jetbrains.com/clion/" },
      { "name": "CMake", "logo": "cmake", "url": "https://cmake.org/" },
      { "name": "Git", "logo": "git", "url": "https://git-scm.com/" },
      { "name": "Docker", "logo": "docker", "url": "https://www.docker.com/" },
      { "name": "VScode", "logo": "vscode", "url": "https://code.visualstudio.com/" }
    ]
  },
  "projects": [
    {
      "repo": "gudtldn/SimpleEngine",
      "summary": "런타임(ECS, Job System, 리플렉션/직렬화)부터 렌더링, 에디터까지 엔진 전반을 구현해 가며 배우는 C++ 게임 엔진",
      "tags": ["C++23", "SDL3GPU", "ECS", "Job System", "Render Graph", "Dear ImGui"],
      "image": "projects/simpleengine.webp",
      "featured": true
    }
  ],
  "infrastructure": [],
  "github": {
    "username": "gudtldn",
    "themeColor": "3b82f6"
  }
}
